{
  "kind": "hook",
  "intent": "session-start",
  "name": "session-start",
  "description": "Bootstrap Aegis discovery and core guidance at the start of every agent session (startup, clear, compact).",
  "visibility": "internal",
  "platforms": ["claude", "opencode"],
  "trigger": {
    "matcher": "startup|clear|compact"
  },
  "x-claude": {
    "event": "SessionStart",
    "matcher": "startup|clear|compact",
    "dispatch": "command",
    "command": ".claude-plugin/hooks/session-start.sh"
  },
  "x-opencode": {
    "event": "experimental.chat.messages.transform",
    "handler": "bootstrap"
  }
}
