{
  "kind": "hook",
  "intent": "pre-compact",
  "name": "pre-compact",
  "description": "Capture durable session anchors (decisions, test names, task anchors) just before Claude compacts the context window, so they survive the summary.",
  "visibility": "internal",
  "platforms": ["claude", "opencode"],
  "trigger": {
    "matcher": "manual|auto"
  },
  "x-claude": {
    "event": "PreCompact",
    "matcher": "manual|auto",
    "dispatch": "command",
    "command": ".claude-plugin/hooks/pre-compact.sh"
  },
  "x-opencode": {
    "event": "experimental.session.compacting",
    "phase": "pre",
    "handler": "compaction"
  }
}
